{
  "schema_version": "2.0.0",
  "comparison_id": "comparison:synthetic:bounded",
  "subject_journey_id": "journey:subject:documented-primary",
  "peer_journey_ids": ["journey:peer-a:documented-primary"],
  "matching_dimensions": [
    {
      "name": "developer-goal",
      "subject_value": "Send one request",
      "peer_values": ["Send one request"],
      "source_ids": ["source:goal"]
    },
    {
      "name": "authentication-model",
      "subject_value": "API key",
      "peer_values": ["API key"],
      "source_ids": ["source:auth"]
    }
  ],
  "differing_dimensions": [],
  "source_ids": ["source:goal", "source:auth"],
  "limitations": ["One qualified peer cannot establish a broader pattern."],
  "research_snapshots": [
    {"journey_id": "journey:subject:documented-primary", "researched_at": "2026-07-01"},
    {"journey_id": "journey:peer-a:documented-primary", "researched_at": "2026-07-01"}
  ],
  "analysis_eligible": true,
  "minimum_comparison_count_met": false,
  "pattern_claim_eligible": false,
  "safe_to_anonymize": true,
  "participant_summary": "The available comparison shows one documented journey using the same authentication model.",
  "withheld_reasons": ["The cohort is too small for broader pattern language."]
}
